{"type":"object","properties":{"danceId":{"type":"string"},"name":{"type":"string"},"src":{"type":"string"},"author":{"type":"string"},"homepage":{"type":"string"},"audio":{"type":"string"},"cover":{"type":"string"},"thumb":{"type":"string"},"readme":{"type":"string"},"createAt":{"type":"string"},"schemaVersion":{"type":"number"}},"required":["danceId","name","src","author","homepage","audio","cover","thumb","createAt","schemaVersion"],"additionalProperties":false,"$schema":"http://json-schema.org/draft-07/schema#"}
